<?xml version="1.0" encoding="UTF-8"?>
<xsd:schema xmlns:xsd="http://www.w3.org/2001/XMLSchema">

    <xsd:element name="faqs">
        <xsd:complexType>
            <xsd:sequence>
                <xsd:element ref="faq" minOccurs="0" maxOccurs="unbounded" />
            </xsd:sequence>
        </xsd:complexType>
    </xsd:element>
    <xsd:element name="faq">
        <xsd:complexType>
            <xsd:sequence>
                <xsd:element ref="id" minOccurs="1" maxOccurs="1"/>
                <xsd:element ref="domanda" minOccurs="1" maxOccurs="1"/>
                <xsd:element ref="risposta" minOccurs="1" maxOccurs="1"/>
                <xsd:element ref="utilitaTotale" minOccurs="1" maxOccurs="1"/>
                <xsd:element ref="idCorso" minOccurs="1" maxOccurs="1"/>
                <xsd:element ref="idAutore" minOccurs="1" maxOccurs="1"/>
                <xsd:element ref="stato" minOccurs="1" maxOccurs="1"/>
            </xsd:sequence>
        </xsd:complexType>
    </xsd:element>
    <xsd:element name="id" type="xsd:integer"/>
    <xsd:element name="domanda" type="xsd:string"/>
    <xsd:element name="risposta" type="xsd:string"/>
    <xsd:element name="utilitaTotale" type="xsd:string"/>
    <xsd:element name="idCorso" type="xsd:integer"/>
    <xsd:element name="idAutore" type="xsd:integer"/>
    <xsd:element name="stato" type="xsd:integer"/>
</xsd:schema>
