<?xml version="1.0" encoding="UTF-8"?>
<faqs xmlns:xsi="http://www.w3.org/2001/XMLSchema-instance" xsi:noNamespaceSchemaLocation="faqs.xsd">
    <faq>
        <id>1</id>
        <domanda>Prova pietro</domanda>
        <risposta>dio dsadasdsadasdas </risposta>
        <utilitaTotale>0</utilitaTotale>
        <idCorso>1</idCorso>
        <idAutore>-1</idAutore>
    </faq>
    <faq>
        <id>2</id>
        <domanda>Yo bto</domanda>
        <risposta />
        <utilitaTotale>0</utilitaTotale>
        <idCorso>1</idCorso>
        <idAutore>1</idAutore>
    </faq>
    <faq>
        <id>3</id>
        <domanda>YO MAN&#13;
</domanda>
        <risposta>duce duce duce</risposta>
        <utilitaTotale>0</utilitaTotale>
        <idCorso>1</idCorso>
        <idAutore>0</idAutore>
    </faq>
    <faq>
        <id>4</id>
        <domanda>Ã¨ reato essere un bastardo negro?&#13;
</domanda>
        <risposta>SI</risposta>
        <utilitaTotale>0</utilitaTotale>
        <idCorso>1</idCorso>
        <idAutore>0</idAutore>
    </faq>
</faqs>